"0","1468067665","Mon Apr 06 23:32:20 PDT 2009","NO_QUERY","tmarthal","Pretty good coaching with exceptional talent trounces exceptional coaching and pretty good talent. MSU "
"0","1468068208","Mon Apr 06 23:32:31 PDT 2009","NO_QUERY","PaulChristian","I hate Tuesdays "
"0","1468068303","Mon Apr 06 23:32:33 PDT 2009","NO_QUERY","rob_fitzpatrick","@gracedent it's her &quot;hair&quot; I can't deal with "
"0","1468068550","Mon Apr 06 23:32:40 PDT 2009","NO_QUERY","trellar","Feel like I'm stuck in a rut. Waiting to hear back from schools is killing me.  Also decided to take a break from #wow for awhile."
"0","1468068604","Mon Apr 06 23:32:39 PDT 2009","NO_QUERY","LLLNaiNai","i need new glasses...mines is hangnon 1 arm "
"0","1468068620","Mon Apr 06 23:32:39 PDT 2009","NO_QUERY","Daryen","Meat Week Day 3: Tummy hurts every night "
"0","1468068726","Mon Apr 06 23:32:42 PDT 2009","NO_QUERY","verruca","Why isn't there a &quot;fake&quot; Verruca on Twitter?... Now i'm sad. "
"0","1468068851","Mon Apr 06 23:32:44 PDT 2009","NO_QUERY","LaceyDanielle33","On the phone with the bestie than shower.. Confused I don't know what to do "
"0","1468068919","Mon Apr 06 23:32:45 PDT 2009","NO_QUERY","vladmech","@Sirrah21 Aww poor froofroo, this is way too late for you "
"0","1468069034","Mon Apr 06 23:32:48 PDT 2009","NO_QUERY","mzrose","i miss my 808 fam "
"0","1468069257","Mon Apr 06 23:32:52 PDT 2009","NO_QUERY","MM_of_Oz","@OfficialPRofOZ she sed puerto rican "
"0","1468069296","Mon Apr 06 23:32:53 PDT 2009","NO_QUERY","SketchStudios","@JoeFernandez @klout your not thinking of selling are you? "
"0","1468069323","Mon Apr 06 23:32:53 PDT 2009","NO_QUERY","zadr","@simX Yeah. I always slow down at the end  ��also, take that! I win."
"0","1468069413","Mon Apr 06 23:32:55 PDT 2009","NO_QUERY","JaylaStarr","@pornstartweet i wanna go, but I am only 20!!!! "
"0","1468069696","Mon Apr 06 23:33:00 PDT 2009","NO_QUERY","730Fam","@LoveMeagan how i mss the snippet hun?..wts it of may i ask?..i wanna hear "
"0","1468069767","Mon Apr 06 23:33:02 PDT 2009","NO_QUERY","bisalibrayall","I know! Big love, true blood and united states of tara have too long of waits between seasons! "
"0","1468070082","Mon Apr 06 23:33:08 PDT 2009","NO_QUERY","Apostasy13","@sensesdestroyer I wanna go to lamb of god "
"0","1468070639","Mon Apr 06 23:33:19 PDT 2009","NO_QUERY","totallydi","is sad she has lost her HN arm band...it just disappeared "
"0","1468071691","Mon Apr 06 23:33:38 PDT 2009","NO_QUERY","ZGibbsWorld","set my alarm to wake up... wanted to speak to my sis in Africa on Skype - I miss her sooo much "
"0","1468072335","Mon Apr 06 23:33:51 PDT 2009","NO_QUERY","ayeVivian","awh damn! my puppy has ticks "
"0","1468072489","Mon Apr 06 23:33:54 PDT 2009","NO_QUERY","annelisebaer","|H|ouse made me sad. Oh, Kutner "
"0","1468072508","Mon Apr 06 23:33:54 PDT 2009","NO_QUERY","zzap","@_saffron  Why not? :["
"0","1468072530","Mon Apr 06 23:33:55 PDT 2009","NO_QUERY","SarahDeG","Why do I keep looking...I know that what I read is gonna hurt but I still look! I guess it's just a girl thing &amp; I need to get over him. "
"0","1468072550","Mon Apr 06 23:33:55 PDT 2009","NO_QUERY","Lizzibear","needs hugs/snuggles... "
"0","1468072756","Mon Apr 06 23:33:59 PDT 2009","NO_QUERY","heartdog","@Health4UandPets saw the one with a GSD covered in them, and I could not stop crying. I just bawled and bawled "
"0","1468074296","Mon Apr 06 23:34:26 PDT 2009","NO_QUERY","musicaddikt787","Rachel and jessy r making me work out  thanks you guy"
"0","1468074472","Mon Apr 06 23:34:30 PDT 2009","NO_QUERY","AllisonBies","I'm wishing I had more time "
"0","1468074513","Mon Apr 06 23:34:31 PDT 2009","NO_QUERY","Lady12s","@mycaricature The only bit that got me really was when he said Babs was a bad mum  I'm sure that hurts her even though she's laughing."
"0","1468074521","Mon Apr 06 23:34:31 PDT 2009","NO_QUERY","h11wiscan","I am not wanting to go to school tomorrow. "
"0","1468074597","Mon Apr 06 23:34:32 PDT 2009","NO_QUERY","PeterHC","Used the term &quot;Fail Whale&quot; to a client on a pitch last night. From their incomprehension corp twitter is being done much lower in the org "
"0","1468074684","Mon Apr 06 23:34:34 PDT 2009","NO_QUERY","rootbeersoup","@rootbeerfloats8 You hate Billy now?! "
"0","1468074989","Mon Apr 06 23:34:40 PDT 2009","NO_QUERY","albertdc","On a 2-day work-week..fast-forward to Thursday please "
"0","1468074996","Mon Apr 06 23:34:40 PDT 2009","NO_QUERY","alice_ismy_hero","@snaprebelx omg i love that show. i would be so mad. i feel ur pain im sorry they spoiled it for u "
"0","1468075009","Mon Apr 06 23:34:41 PDT 2009","NO_QUERY","luciebartlett","Is it possible to die from coughing? It SUCKS being ill "
"0","1468075102","Mon Apr 06 23:34:42 PDT 2009","NO_QUERY","Lilli_Allen","cant believe i have to go all the way to Barnes for work today....instead of a 5minute walk to St Johns Wood "
"0","1468075470","Mon Apr 06 23:34:49 PDT 2009","NO_QUERY","natdigsyou","@paulieseow hahahahahah i can easily make ice milo but its just not the same "
"0","1468075552","Mon Apr 06 23:34:53 PDT 2009","NO_QUERY","kersten_k","why do both of my best friends have to be shitty simultaneously?  Can u at least take turns hurting my feelings? jerks..    going 2 sleep."
"0","1468075570","Mon Apr 06 23:34:50 PDT 2009","NO_QUERY","MJ_Watson","My #art is regressing... "
"0","1468075671","Mon Apr 06 23:34:52 PDT 2009","NO_QUERY","im_mature","@onlysweeter I don't know the dance. "
"0","1468075908","Mon Apr 06 23:34:56 PDT 2009","NO_QUERY","Georgiesaur","@laurwee_boo im ok I guess had a hard day "
"0","1468076498","Mon Apr 06 23:35:06 PDT 2009","NO_QUERY","Dogbook","Jade is looking for a new home...  http://apps.facebook.com/dogbook/profile/view/4744827"
"0","1468076636","Mon Apr 06 23:35:09 PDT 2009","NO_QUERY","britto819","damnnn! i missed 11:11 "
"0","1468076724","Mon Apr 06 23:35:10 PDT 2009","NO_QUERY","RebeccaLange","@sarahprout tweetfinder hates me  and I was having trouble with background on twitter,what do you think?"
"0","1468076745","Mon Apr 06 23:35:11 PDT 2009","NO_QUERY","ryanmwilson","@Twilighter4Life lol yeh ill be studying  stupid uni. only 2 more weeks and im on holidays! YAY! plus my birthday next week woot"
"0","1468076942","Mon Apr 06 23:35:15 PDT 2009","NO_QUERY","geekpondering","@transbay &quot;SFMTA Budget Proposal Hearing: tomorrow, April 7 at 2:00 pm (City Hall, Room 400). Sadly, I cannot attend.&quot; Me neither. "
"0","1468077336","Mon Apr 06 23:35:22 PDT 2009","NO_QUERY","crunchysoft","is afraid that her G.I. notes will not read themselves. "
"0","1468077666","Mon Apr 06 23:35:28 PDT 2009","NO_QUERY","eduardtee","*Sigh* Rain??? Why did you decide to show up? Move away! You were not invited to the Tuesday-party  (this is not the start I hoped for)"
"0","1468077685","Mon Apr 06 23:35:28 PDT 2009","NO_QUERY","ann_donnelly","_secretgarden_ I haven't gotten any porn spammers  I don't check my followers, but haven't had any tweets like that."
"0","1468077700","Mon Apr 06 23:35:28 PDT 2009","NO_QUERY","senorkaos","Somebody is selling the Japan only release of my first album on E Bay for $25. Damn thats it? A classic is worth more than that! "
"0","1468078010","Mon Apr 06 23:35:34 PDT 2009","NO_QUERY","scorpfromhell","@charleneli Disqus now integrates conversations on many platforms. haven't heard abt JS-Kit "
"0","1468078113","Mon Apr 06 23:35:36 PDT 2009","NO_QUERY","birken_bagz","and they advertising fake louis bags as 100% authentic on google  i'm pissed!"
"0","1468078493","Mon Apr 06 23:35:44 PDT 2009","NO_QUERY","kennyduduxd","Can't sleep  dam naps lol... and its hot"
"0","1468078738","Mon Apr 06 23:35:49 PDT 2009","NO_QUERY","SarahDeG","Why do I keep looking...I know that what I read is gonna hurt but I still look! I guess it's just a girl thing. "
"0","1468078957","Mon Apr 06 23:35:53 PDT 2009","NO_QUERY","whitet","@henrygooden @oddchicken I went there about a month and a half ago, was still open then. Smelt really good, but I was getting sick "
"0","1468079019","Mon Apr 06 23:35:54 PDT 2009","NO_QUERY","miseducatedone","is ready to go to bed..long day tomorrow "
"0","1468079128","Mon Apr 06 23:35:56 PDT 2009","NO_QUERY","wilmir","job searching.....FYI: Yahoo HOT JOBS suck! .. im never going to find a job "
"0","1468079178","Mon Apr 06 23:35:57 PDT 2009","NO_QUERY","l33tmyst","No electricity today, so no tweets. "
"0","1468079556","Mon Apr 06 23:36:04 PDT 2009","NO_QUERY","_Kaden_","@big_think Can Zack tell me how to edit my Bio/Profile? Why create a login at a different co's site to get an answer from BT TechHelp? "
"0","1468079864","Mon Apr 06 23:36:10 PDT 2009","NO_QUERY","sarahgb","Morning all, starving and dying for a cuppa but can't cos off to docs for fasting blood test in a little while "
"0","1468080181","Mon Apr 06 23:36:16 PDT 2009","NO_QUERY","grimorde","Very tired this morning - no idea why! Great start to the day "
"0","1468080415","Mon Apr 06 23:36:20 PDT 2009","NO_QUERY","jewellerybyshal","Morning All, I'm back from my little break from the computer. back to work again today "
"0","1468080516","Mon Apr 06 23:36:22 PDT 2009","NO_QUERY","one_sock","At mobilityvic.org launch.  No grog  nice video from PWC though"
"0","1468080524","Mon Apr 06 23:36:22 PDT 2009","NO_QUERY","Msjackson88","still no &quot;followers&quot;   please some1 inform me on how this works????"
"0","1468080677","Mon Apr 06 23:36:25 PDT 2009","NO_QUERY","loveeyuu_x","misses him right now. i need a hug "
"0","1468081296","Mon Apr 06 23:36:38 PDT 2009","NO_QUERY","kieranmcgrady","Tried to get up earlier today........didn't work out "
"0","1468082050","Mon Apr 06 23:36:53 PDT 2009","NO_QUERY","wrynex","Omg revisions revisions revisions! I feel like I wasted an amazingly beautiful day today doing pointless work "
"0","1468082561","Mon Apr 06 23:37:03 PDT 2009","NO_QUERY","barbyang","Foot is out of commission  ouch! Running this morning did not help...not smart."
"0","1468082681","Mon Apr 06 23:37:08 PDT 2009","NO_QUERY","tawalker","About to shower, which I hope will wake me up at last. Oh, and the synth experiments yielded nothing last night "
"0","1468082840","Mon Apr 06 23:37:08 PDT 2009","NO_QUERY","bsummers69","is really bored and really sleepy...and mad she can't find a custom lanyard maker that wont make me buy 1000000 minimum "
"0","1468083507","Mon Apr 06 23:37:22 PDT 2009","NO_QUERY","hellosquash","@cmykevin ooh nice! but williams sonoma already got to me. "
"0","1468083579","Mon Apr 06 23:37:23 PDT 2009","NO_QUERY","unijono","I've finally given in. Now at Malaysian restaurant waiting for nasi lemak and teh Tarik. Mereka tak faham bm...  http://twitpic.com/2y4bh"
"0","1468083777","Mon Apr 06 23:37:27 PDT 2009","NO_QUERY","SteveJT13","Waitin 4 the theory test centre 2 open "
"0","1468083884","Mon Apr 06 23:37:29 PDT 2009","NO_QUERY","pstannard1","got woken up this mornng at 7am - damn Lorry , van and car accident just outside on our main road also causing car alarms to go off.  "
"0","1468084012","Mon Apr 06 23:37:32 PDT 2009","NO_QUERY","yehsung","I think I need to get laid. Sad revolution I had earlier rofl "
"0","1468084023","Mon Apr 06 23:37:32 PDT 2009","NO_QUERY","muchloveanna","@ourcitylight that was so sudden!! "
"0","1468084476","Mon Apr 06 23:37:41 PDT 2009","NO_QUERY","deafdorkette86","Now i want Amanita  ...someone made me feel unliving."
"0","1468084610","Mon Apr 06 23:37:43 PDT 2009","NO_QUERY","reeeeeCy","@lanaRISQUE hahahahhha!! hows your food poisening going? has it gone away? "
"0","1468084774","Mon Apr 06 23:37:47 PDT 2009","NO_QUERY","tsarnick","@MissxMarisa haven't heard from Hannah at all yet!! it's very disappointing "
"0","1468085048","Mon Apr 06 23:37:52 PDT 2009","NO_QUERY","policano","@hutsoncap  everything alright?"
"0","1468085613","Mon Apr 06 23:38:03 PDT 2009","NO_QUERY","jaimie115","is procrastinating... i feel ill.. but don't want to go to bed.  "
"0","1468086039","Mon Apr 06 23:38:11 PDT 2009","NO_QUERY","jacpadraic","@danielhalpin Gonna try and find a sports bar to watch that at... not got a chance though I don't think "
"0","1468086949","Mon Apr 06 23:38:29 PDT 2009","NO_QUERY","jmis","wants to go home and watch The Hills "
"0","1468086969","Mon Apr 06 23:38:30 PDT 2009","NO_QUERY","the_bear123","@sarmar I guess I'm out of funny "
"0","1468087058","Mon Apr 06 23:38:31 PDT 2009","NO_QUERY","acnewhouse","@moethebeat aww moe! I was planning on leaving tomorrow evening  are you gonna be in town by chance?"
"0","1468087207","Mon Apr 06 23:38:34 PDT 2009","NO_QUERY","guitarrfingerss","i wanna write, but i'm not cool enough to make up a storylineee. "
"0","1468087387","Mon Apr 06 23:38:37 PDT 2009","NO_QUERY","iamcheerbear","@Gripping agreed! love the sound, but hates how everyone knows them "
"0","1468087595","Mon Apr 06 23:38:42 PDT 2009","NO_QUERY","rstolan","@brendamew2 no art tomorrow.  and nice to see you've joined twitter!"
"0","1468087596","Mon Apr 06 23:38:42 PDT 2009","NO_QUERY","ScribblesNZ","Sigh, I think my PMS is making my mind totally over-analyse things and making me sad "
"0","1468087761","Mon Apr 06 23:38:45 PDT 2009","NO_QUERY","TristenPelton","@doriantaylor I had one outside my patio. I named him Rex. Then the gardner took him down. RIP Rex "
"0","1468088145","Mon Apr 06 23:38:53 PDT 2009","NO_QUERY","nbrooks","Ooops. Just ate a panini from W-mart cold that says it needed to be thoroughly cooked. It didn't taste raw. I die nao from f. poisoning? "
"0","1468088351","Mon Apr 06 23:38:57 PDT 2009","NO_QUERY","CathySavels","Good morning for a very rainy France  No gardening for me today."
"0","1468088416","Mon Apr 06 23:38:59 PDT 2009","NO_QUERY","unclekins","If ever there was a day for staying in bed, today is it "
"0","1468088569","Mon Apr 06 23:39:02 PDT 2009","NO_QUERY","bsag","Got to take Cleo to the vets. Not sure what's wrong with her but she's feeling very sorry for herself. "
"0","1468093045","Mon Apr 06 23:40:30 PDT 2009","NO_QUERY","miavida","today is day 1 of my fast &amp; i feel i may break b4 i go 2 bed  i must hold out til the end of the wk! must stayed focused, wish me luck..."
"0","1468093070","Mon Apr 06 23:40:31 PDT 2009","NO_QUERY","Lexi_83","Extremely jealous... "
"0","1468093249","Mon Apr 06 23:40:34 PDT 2009","NO_QUERY","mandylovee","@kimmyawesome Ohhhh that sucks  I love the summer set."
"0","1468093291","Mon Apr 06 23:40:35 PDT 2009","NO_QUERY","gonzopants","@daydee tell it you forgot your password &amp; it will give you a new one. it's the only way I can prevent tons of spam "
"0","1468093327","Mon Apr 06 23:40:36 PDT 2009","NO_QUERY","ergoelaine","bedtime. wake up call at 7am "
"0","1468093373","Mon Apr 06 23:40:37 PDT 2009","NO_QUERY","IgnivomousLo","So glad I made it through work - with an extra hour too and my paycheck.  Still waiting on the one I lost though "
"0","1468093726","Mon Apr 06 23:40:43 PDT 2009","NO_QUERY","purplewolf","Mum's been taken to hospital, they don't know what's wrong, she's been vomiting since yesterday. Rushing back to get to the hospital "
"0","1468093942","Mon Apr 06 23:40:47 PDT 2009","NO_QUERY","Cynxster","congested nose "
"0","1468094166","Mon Apr 06 23:40:53 PDT 2009","NO_QUERY","marissazaguirre","Can't sleep. Need to talk to someone. "
"0","1468094312","Mon Apr 06 23:40:54 PDT 2009","NO_QUERY","chacuatol","@penalba por favor decime ke no estas involucrado en esa pagina nicatrolls, they're THE CANCER that's killing /b/ "
"0","1468094825","Mon Apr 06 23:41:05 PDT 2009","NO_QUERY","marie_660","too cold and tired to write good twitter. everyone was obeying the cops tonight, total dissappointment. we were so close "
"0","1468095418","Mon Apr 06 23:41:17 PDT 2009","NO_QUERY","MizzCenaa94","Lifee Gets Worsee &amp;&amp; Worsee "
"0","1468096121","Mon Apr 06 23:41:31 PDT 2009","NO_QUERY","mickyj","@dnwallace - I am shuddering and shaking too "
"0","1468096420","Mon Apr 06 23:41:39 PDT 2009","NO_QUERY","briggsy424","Sorting brekkie for the kids then off to the horrible place called work, boohoo "
"0","1468096934","Mon Apr 06 23:41:47 PDT 2009","NO_QUERY","arge18","my condolences to natasha richardson's family "
"0","1468096949","Mon Apr 06 23:41:47 PDT 2009","NO_QUERY","AliceAguera","@LittleYellowJen what do don't think ily?? nawwww "
"0","1468096988","Mon Apr 06 23:41:48 PDT 2009","NO_QUERY","mokargas","Where's Derrick  http://ff.im/-1XWXs"
"0","1468097006","Mon Apr 06 23:41:49 PDT 2009","NO_QUERY","gillana","Needs to stop sleeping all day.. Causes some problems when you're wide awake at 2:45am... "
"0","1468097160","Mon Apr 06 23:41:52 PDT 2009","NO_QUERY","ennaig","missed today's ELLEN "
"0","1468097165","Mon Apr 06 23:41:52 PDT 2009","NO_QUERY","Raaawry","I suddenly miss my Flintstones vitamin tablets  SOOOO GOOOOD"
"0","1468097181","Mon Apr 06 23:41:52 PDT 2009","NO_QUERY","LittleMissLea","@mattpro13 legitimately good cops out there "
"0","1468097375","Mon Apr 06 23:41:56 PDT 2009","NO_QUERY","kienke1","@onlytosee Twitter's been doing that to me tooo. "
"0","1468097430","Mon Apr 06 23:41:58 PDT 2009","NO_QUERY","im_mature","@pealuh I think I need to go to Twitterholics Anonymous...... "
"0","1468097515","Mon Apr 06 23:41:59 PDT 2009","NO_QUERY","quitthebiz","@lizhenry we haven't heard from her or sha. "
"0","1468098122","Mon Apr 06 23:42:10 PDT 2009","NO_QUERY","britney101","my heart has been broken. "
"0","1468098356","Mon Apr 06 23:42:15 PDT 2009","NO_QUERY","me_emmy","i forgot how to sleep "
"0","1468098454","Mon Apr 06 23:42:17 PDT 2009","NO_QUERY","jeffsimons","Morning everyone! In serious need of some decent coffee.. why isn't the catering open yet at 08.30? "
"0","1468098463","Mon Apr 06 23:42:17 PDT 2009","NO_QUERY","imsoapee","@mostazzza Im sorry I've failed you "
"0","1468098558","Mon Apr 06 23:42:19 PDT 2009","NO_QUERY","FallenStar1","@CodaQueen oh wait he does have 1 in Oakland on the 18th. Can't understand why he only has 1 &amp; in Oakland "
"0","1468098819","Mon Apr 06 23:42:27 PDT 2009","NO_QUERY","honeydrop25","is missing talking to my bff on da phone!!!! "
"0","1468098952","Mon Apr 06 23:42:27 PDT 2009","NO_QUERY","Mina_Minaa","wondering why I am so stupid  Need to eat more fish I guess *sigh*..."
"0","1468098976","Mon Apr 06 23:42:27 PDT 2009","NO_QUERY","Stephfy","i miss my old friends from elementary ans middle school "
"0","1468099029","Mon Apr 06 23:42:28 PDT 2009","NO_QUERY","webmyc","@twitter please fix this http://sp2.ro/5b7bdb because it brakes all external twitter avatar searches "
"0","1468099380","Mon Apr 06 23:42:34 PDT 2009","NO_QUERY","Kegs1528","looks like i've missed out on yet another job  someone please employ me! Haha"
"0","1468099707","Mon Apr 06 23:42:41 PDT 2009","NO_QUERY","Wyldceltic1","@tacce dang, I'll get HOUSE off iTunes. I hear it was a devastating episode "
"0","1468099902","Mon Apr 06 23:42:44 PDT 2009","NO_QUERY","MamaGeee","Wow.... the shout box has kicked me out and I can't get back in. I guess this means good night "
"0","1468099958","Mon Apr 06 23:42:46 PDT 2009","NO_QUERY","hypatiadotca","Slideshare's embed code is annoying me.  Sorry about the tiny embed  #fail"
"0","1468100148","Mon Apr 06 23:42:49 PDT 2009","NO_QUERY","choclatdrop404","@Flawless326 Why did my baby have to eat 3 prunes today and now he finally went ! My poor baby "
"0","1468100346","Mon Apr 06 23:42:53 PDT 2009","NO_QUERY","PizzaAndMe2830","I'am bored. Nothing to do! "
"0","1468100486","Mon Apr 06 23:42:56 PDT 2009","NO_QUERY","Eggert","morning all - 1st appointment of the day - the dentist ! "
"0","1468100519","Mon Apr 06 23:42:58 PDT 2009","NO_QUERY","ReallyCookin","@amyserrata he wrote most of the album, but ironically, the singles he did not write "
"0","1468100557","Mon Apr 06 23:42:57 PDT 2009","NO_QUERY","ItsAnAllyGator","Someone PLEASE take Gossip Girl away from me. I'm addicted "
"0","1468100580","Mon Apr 06 23:42:57 PDT 2009","NO_QUERY","cristygarza","good night swetdreamss to everyonee   and jared never chat in kyte puff "
"0","1468100599","Mon Apr 06 23:43:00 PDT 2009","NO_QUERY","SHRIKEE","Horrible sore throat  hurts"
"0","1468100611","Mon Apr 06 23:42:58 PDT 2009","NO_QUERY","magpyr","Time to get dressed, I suppose...gah another workday "
"0","1468100783","Mon Apr 06 23:43:02 PDT 2009","NO_QUERY","apinkphoenix","Not to self: licking off pudding from a seafood fork, not so enjoyable as slowly licking off of a spoon "
"0","1468101128","Mon Apr 06 23:43:08 PDT 2009","NO_QUERY","jaydenbravo","All ready to go to the premier and just realized how under dressed I am "
"0","1468101243","Mon Apr 06 23:43:12 PDT 2009","NO_QUERY","ShannaMoakler","It just makes me happy! over and over again. I wish I wan't afraid to fly  http://tinyurl.com/64skpp"
"0","1468101383","Mon Apr 06 23:43:14 PDT 2009","NO_QUERY","Getatnance","@Eyrro awwwww bummerr...sorry missed it again "
"0","1468101407","Mon Apr 06 23:43:14 PDT 2009","NO_QUERY","metacosm","Waking up to the sound of jackhammers is not a pleasant way to start the day. "
"0","1468101464","Mon Apr 06 23:43:15 PDT 2009","NO_QUERY","chelseabets","@almostcool i'm off now "
"0","1468101471","Mon Apr 06 23:43:16 PDT 2009","NO_QUERY","SaraHDanger","@jon8737 that just totally made my night, LMAO. They were like screaming at me and I couldn't focus on the 900 mph song "
"0","1468101740","Mon Apr 06 23:43:23 PDT 2009","NO_QUERY","anthonypending","Nevada is really long and the gas pumps are down   But on a good note I just won $5 in a slot machine!!  I love to gamble!!!"
"0","1468101838","Mon Apr 06 23:43:24 PDT 2009","NO_QUERY","m0on7chiLd","@amirrabennett nope. baby's due in 5th may! getting closer but still 1001 things not done "
"0","1468101990","Mon Apr 06 23:43:26 PDT 2009","NO_QUERY","MellyFed","headache "
"0","1468102659","Mon Apr 06 23:43:40 PDT 2009","NO_QUERY","marenafaye","is still effinggggg sick  when will i get better?! ughh"
"0","1468102669","Mon Apr 06 23:43:42 PDT 2009","NO_QUERY","Shipeah","Still in bed and don�t want to do anything else. University is callung too loud "
"0","1468102767","Mon Apr 06 23:43:42 PDT 2009","NO_QUERY","kareemdmapantz","seattle is in tents! i miss my T.O. peepz tho "
"0","1468102926","Mon Apr 06 23:43:45 PDT 2009","NO_QUERY","ShannaMoakler","It just makes me happy! over and over again! I just wish I wasn't afraid to fly  http://tinyurl.com/64skpp"
"0","1468103009","Mon Apr 06 23:43:49 PDT 2009","NO_QUERY","AlyssaSpears","Errrggggg! My tummy hurts. "
"0","1468103052","Mon Apr 06 23:43:48 PDT 2009","NO_QUERY","essjaydownunder","thought it would be interesting to get F1 updates from Twitter, slightly regretting the decision, I can't see anyone elses's updates "
"0","1468103231","Mon Apr 06 23:43:51 PDT 2009","NO_QUERY","vtowncanes29","ripped switcheasy colors "
"0","1468103554","Mon Apr 06 23:43:58 PDT 2009","NO_QUERY","fatfunk","We failed that song "
"0","1468103797","Mon Apr 06 23:44:03 PDT 2009","NO_QUERY","taco_bella"," poor mel. Feeling your pain."
"0","1468106339","Mon Apr 06 23:44:55 PDT 2009","NO_QUERY","Syph0n","Ugh. still working on project  just taking a small break"
"0","1468106399","Mon Apr 06 23:44:57 PDT 2009","NO_QUERY","robotwarlord","The one day I have to go to school is the same day something exciting happens at parliament square "
"0","1468106999","Mon Apr 06 23:45:07 PDT 2009","NO_QUERY","stuartheron","@watko Shockingly not! "
"0","1468107136","Mon Apr 06 23:45:09 PDT 2009","NO_QUERY","reiver","Today was a less interesting day on Twitter. @cboyack , @igeldard , and @iidiocracy were all kind of quiet today "
"0","1468107193","Mon Apr 06 23:45:11 PDT 2009","NO_QUERY","blong24","@CourtneyBrwn awww thanks.. i hate being sick "
"0","1468107293","Mon Apr 06 23:45:12 PDT 2009","NO_QUERY","norawatkins","VIP guests today -________-&quot;   blohheeee       I HATE it "
"0","1468107426","Mon Apr 06 23:45:15 PDT 2009","NO_QUERY","iain20","Up early "
"0","1468107473","Mon Apr 06 23:45:16 PDT 2009","NO_QUERY","iwantyourjeep","WHAT THE FUCK YOUKU  I WANT TO WATCH SKINS."
"0","1468107670","Mon Apr 06 23:45:21 PDT 2009","NO_QUERY","Justineeweenie","i forgot my phone in my car but i'm too scared to go outside and get it. "
"0","1468107957","Mon Apr 06 23:45:24 PDT 2009","NO_QUERY","CuriousLifeofGA","I totally forgot we were going to do fisheye 2night   What u doing Thursday....  Btw.... I'm so late with the hills... LOL"
"0","1468107995","Mon Apr 06 23:45:25 PDT 2009","NO_QUERY","keldawg23","totally shocked by the episode of house this eveing  Lost one of my favorite characters."
"0","1468108049","Mon Apr 06 23:45:26 PDT 2009","NO_QUERY","xfxf","@offbytwo seeing a doctor i hope? "
"0","1468108121","Mon Apr 06 23:45:28 PDT 2009","NO_QUERY","snickerducky","didn't pass the first part of the CSET  I missed it by 5 effing points!"
"0","1468108431","Mon Apr 06 23:45:34 PDT 2009","NO_QUERY","Wyldceltic1","@KevinPeterson the 2G cases were like that. But scratches don't void your warrenty, dents do... As I found out "
"0","1468108602","Mon Apr 06 23:45:37 PDT 2009","NO_QUERY","soundslikechaos","I have chapped lips, boo "
"0","1468108670","Mon Apr 06 23:45:38 PDT 2009","NO_QUERY","natalieantipas","@ryleebeth ye im not  very sad...but weirdly enough shes lettin me go 2 da party?? how confusing parents r?? lol"
"0","1468108857","Mon Apr 06 23:45:42 PDT 2009","NO_QUERY","jimh","@Kimboinlimbo no chance of that coming back when it'd be 20 mins faster than the Javelins though "
"0","1468108912","Mon Apr 06 23:45:43 PDT 2009","NO_QUERY","LauraOrchard","bored and lonely "
"0","1468108999","Mon Apr 06 23:45:45 PDT 2009","NO_QUERY","BirkanTore","Back to classic rainy Amsterdam days "
"0","1468109005","Mon Apr 06 23:45:45 PDT 2009","NO_QUERY","AussieJassy","feels like crying that's how sick i feel "
"0","1468109330","Mon Apr 06 23:45:52 PDT 2009","NO_QUERY","feverishpoptart","@Horrors_Wench Me toooooo! I feel like I've been on the verge of an anxiety attack all day.  "
